{
  "domain": ["shop", "tracker"],
  "nF": 3000,
  "eligibleInputs": [],
  "entities": [
    { "id": "ext-shop-0001", "domain": "shop", "authorBatch": "shop-b001", "eligible": true },
    { "id": "ext-shop-0002", "domain": "shop", "authorBatch": "shop-b001", "eligible": true },
    { "id": "ext-shop-0003", "domain": "shop", "authorBatch": "shop-b001", "eligible": true },
    { "id": "ext-shop-0004", "domain": "shop", "authorBatch": "shop-b001", "eligible": true },
    { "id": "ext-shop-0005", "domain": "shop", "authorBatch": "shop-b001", "eligible": true },
    { "id": "ext-shop-0006", "domain": "shop", "authorBatch": "shop-b001", "eligible": true },
    { "id": "ext-shop-0007", "domain": "shop", "authorBatch": "shop-b001", "eligible": true },
    { "id": "ext-shop-0008", "domain": "shop", "authorBatch": "shop-b001", "eligible": true },
    { "id": "ext-shop-0009", "domain": "shop", "authorBatch": "shop-b001", "eligible": true },
    { "id": "ext-shop-0010", "domain": "shop", "authorBatch": "shop-b001", "eligible": true },
    { "id": "ext-shop-0011", "domain": "shop", "authorBatch": "shop-b001", "eligible": true },
    { "id": "ext-shop-0012", "domain": "shop", "authorBatch": "shop-b001", "eligible": true },
    { "id": "ext-shop-0013", "domain": "shop", "authorBatch": "shop-b001", "eligible": true },
    { "id": "ext-shop-0014", "domain": "shop", "authorBatch": "shop-b001", "eligible": true },
    { "id": "ext-shop-0015", "domain": "shop", "authorBatch": "shop-b001", "eligible": true },
    { "id": "ext-shop-0016", "domain": "shop", "authorBatch": "shop-b001", "eligible": true },
    { "id": "ext-shop-0017", "domain": "shop", "authorBatch": "shop-b001", "eligible": true },
    { "id": "ext-shop-0018", "domain": "shop", "authorBatch": "shop-b001", "eligible": true },
    { "id": "ext-shop-0019", "domain": "shop", "authorBatch": "shop-b001", "eligible": true },
    { "id": "ext-shop-0020", "domain": "shop", "authorBatch": "shop-b001", "eligible": true },
    { "id": "ext-shop-0021", "domain": "shop", "authorBatch": "shop-b001", "eligible": true },
    { "id": "ext-shop-0022", "domain": "shop", "authorBatch": "shop-b001", "eligible": true },
    { "id": "ext-shop-0023", "domain": "shop", "authorBatch": "shop-b001", "eligible": true },
    { "id": "ext-shop-0024", "domain": "shop", "authorBatch": "shop-b001", "eligible": true },
    { "id": "ext-shop-0025", "domain": "shop", "authorBatch": "shop-b001", "eligible": true },
    { "id": "ext-shop-0026", "domain": "shop", "authorBatch": "shop-b002", "eligible": true },
    { "id": "ext-shop-0027", "domain": "shop", "authorBatch": "shop-b002", "eligible": true },
    { "id": "ext-shop-0028", "domain": "shop", "authorBatch": "shop-b002", "eligible": true },
    { "id": "ext-shop-0029", "domain": "shop", "authorBatch": "shop-b002", "eligible": true },
    { "id": "ext-shop-0030", "domain": "shop", "authorBatch": "shop-b002", "eligible": true },
    { "id": "ext-shop-0031", "domain": "shop", "authorBatch": "shop-b002", "eligible": true },
    { "id": "ext-shop-0032", "domain": "shop", "authorBatch": "shop-b002", "eligible": true },
    { "id": "ext-shop-0033", "domain": "shop", "authorBatch": "shop-b002", "eligible": true },
    { "id": "ext-shop-0034", "domain": "shop", "authorBatch": "shop-b002", "eligible": true },
    { "id": "ext-shop-0035", "domain": "shop", "authorBatch": "shop-b002", "eligible": true },
    { "id": "ext-shop-0036", "domain": "shop", "authorBatch": "shop-b002", "eligible": true },
    { "id": "ext-shop-0037", "domain": "shop", "authorBatch": "shop-b002", "eligible": true },
    { "id": "ext-shop-0038", "domain": "shop", "authorBatch": "shop-b002", "eligible": true },
    { "id": "ext-shop-0039", "domain": "shop", "authorBatch": "shop-b002", "eligible": true },
    { "id": "ext-shop-0040", "domain": "shop", "authorBatch": "shop-b002", "eligible": true },
    { "id": "ext-shop-0041", "domain": "shop", "authorBatch": "shop-b002", "eligible": true },
    { "id": "ext-shop-0042", "domain": "shop", "authorBatch": "shop-b002", "eligible": true },
    { "id": "ext-shop-0043", "domain": "shop", "authorBatch": "shop-b002", "eligible": true },
    { "id": "ext-shop-0044", "domain": "shop", "authorBatch": "shop-b002", "eligible": true },
    { "id": "ext-shop-0045", "domain": "shop", "authorBatch": "shop-b002", "eligible": true },
    { "id": "ext-shop-0046", "domain": "shop", "authorBatch": "shop-b002", "eligible": true },
    { "id": "ext-shop-0047", "domain": "shop", "authorBatch": "shop-b002", "eligible": true },
    { "id": "ext-shop-0048", "domain": "shop", "authorBatch": "shop-b002", "eligible": true },
    { "id": "ext-shop-0049", "domain": "shop", "authorBatch": "shop-b002", "eligible": true },
    { "id": "ext-shop-0050", "domain": "shop", "authorBatch": "shop-b002", "eligible": true },
    { "id": "ext-shop-0051", "domain": "shop", "authorBatch": "shop-b003", "eligible": true },
    { "id": "ext-shop-0052", "domain": "shop", "authorBatch": "shop-b003", "eligible": true },
    { "id": "ext-shop-0053", "domain": "shop", "authorBatch": "shop-b003", "eligible": true },
    { "id": "ext-shop-0054", "domain": "shop", "authorBatch": "shop-b003", "eligible": true },
    { "id": "ext-shop-0055", "domain": "shop", "authorBatch": "shop-b003", "eligible": true },
    { "id": "ext-shop-0056", "domain": "shop", "authorBatch": "shop-b003", "eligible": true },
    { "id": "ext-shop-0057", "domain": "shop", "authorBatch": "shop-b003", "eligible": true },
    { "id": "ext-shop-0058", "domain": "shop", "authorBatch": "shop-b003", "eligible": true },
    { "id": "ext-shop-0059", "domain": "shop", "authorBatch": "shop-b003", "eligible": true },
    { "id": "ext-shop-0060", "domain": "shop", "authorBatch": "shop-b003", "eligible": true },
    { "id": "ext-shop-0061", "domain": "shop", "authorBatch": "shop-b003", "eligible": true },
    { "id": "ext-shop-0062", "domain": "shop", "authorBatch": "shop-b003", "eligible": true },
    { "id": "ext-shop-0063", "domain": "shop", "authorBatch": "shop-b003", "eligible": true },
    { "id": "ext-shop-0064", "domain": "shop", "authorBatch": "shop-b003", "eligible": true },
    { "id": "ext-shop-0065", "domain": "shop", "authorBatch": "shop-b003", "eligible": true },
    { "id": "ext-shop-0066", "domain": "shop", "authorBatch": "shop-b003", "eligible": true },
    { "id": "ext-shop-0067", "domain": "shop", "authorBatch": "shop-b003", "eligible": true },
    { "id": "ext-shop-0068", "domain": "shop", "authorBatch": "shop-b003", "eligible": true },
    { "id": "ext-shop-0069", "domain": "shop", "authorBatch": "shop-b003", "eligible": true },
    { "id": "ext-shop-0070", "domain": "shop", "authorBatch": "shop-b003", "eligible": true },
    { "id": "ext-shop-0071", "domain": "shop", "authorBatch": "shop-b003", "eligible": true },
    { "id": "ext-shop-0072", "domain": "shop", "authorBatch": "shop-b003", "eligible": true },
    { "id": "ext-shop-0073", "domain": "shop", "authorBatch": "shop-b003", "eligible": true },
    { "id": "ext-shop-0074", "domain": "shop", "authorBatch": "shop-b003", "eligible": true },
    { "id": "ext-shop-0075", "domain": "shop", "authorBatch": "shop-b003", "eligible": true },
    { "id": "ext-shop-0076", "domain": "shop", "authorBatch": "shop-b004", "eligible": true },
    { "id": "ext-shop-0077", "domain": "shop", "authorBatch": "shop-b004", "eligible": true },
    { "id": "ext-shop-0078", "domain": "shop", "authorBatch": "shop-b004", "eligible": true },
    { "id": "ext-shop-0079", "domain": "shop", "authorBatch": "shop-b004", "eligible": true },
    { "id": "ext-shop-0080", "domain": "shop", "authorBatch": "shop-b004", "eligible": true },
    { "id": "ext-shop-0081", "domain": "shop", "authorBatch": "shop-b004", "eligible": true },
    { "id": "ext-shop-0082", "domain": "shop", "authorBatch": "shop-b004", "eligible": true },
    { "id": "ext-shop-0083", "domain": "shop", "authorBatch": "shop-b004", "eligible": true },
    { "id": "ext-shop-0084", "domain": "shop", "authorBatch": "shop-b004", "eligible": true },
    { "id": "ext-shop-0085", "domain": "shop", "authorBatch": "shop-b004", "eligible": true },
    { "id": "ext-shop-0086", "domain": "shop", "authorBatch": "shop-b004", "eligible": true },
    { "id": "ext-shop-0087", "domain": "shop", "authorBatch": "shop-b004", "eligible": true },
    { "id": "ext-shop-0088", "domain": "shop", "authorBatch": "shop-b004", "eligible": true },
    { "id": "ext-shop-0089", "domain": "shop", "authorBatch": "shop-b004", "eligible": true },
    { "id": "ext-shop-0090", "domain": "shop", "authorBatch": "shop-b004", "eligible": true },
    { "id": "ext-shop-0091", "domain": "shop", "authorBatch": "shop-b004", "eligible": true },
    { "id": "ext-shop-0092", "domain": "shop", "authorBatch": "shop-b004", "eligible": true },
    { "id": "ext-shop-0093", "domain": "shop", "authorBatch": "shop-b004", "eligible": true },
    { "id": "ext-shop-0094", "domain": "shop", "authorBatch": "shop-b004", "eligible": true },
    { "id": "ext-shop-0095", "domain": "shop", "authorBatch": "shop-b004", "eligible": true },
    { "id": "ext-shop-0096", "domain": "shop", "authorBatch": "shop-b004", "eligible": true },
    { "id": "ext-shop-0097", "domain": "shop", "authorBatch": "shop-b004", "eligible": true },
    { "id": "ext-shop-0098", "domain": "shop", "authorBatch": "shop-b004", "eligible": true },
    { "id": "ext-shop-0099", "domain": "shop", "authorBatch": "shop-b004", "eligible": true },
    { "id": "ext-shop-0100", "domain": "shop", "authorBatch": "shop-b004", "eligible": true },
    { "id": "ext-shop-0101", "domain": "shop", "authorBatch": "shop-b005", "eligible": true },
    { "id": "ext-shop-0102", "domain": "shop", "authorBatch": "shop-b005", "eligible": true },
    { "id": "ext-shop-0103", "domain": "shop", "authorBatch": "shop-b005", "eligible": true },
    { "id": "ext-shop-0104", "domain": "shop", "authorBatch": "shop-b005", "eligible": true },